ticker,title,num_comments,comment_sentiment_average,latest_comment_date,score,upvote_ratio,date,domain,num_crossposts,author,timestamp,commentdate
GS,"I ordered a Fisker FSR great play, lying GS DOOSH Analyst $10 PT when BOA $31 LOL these guys are educated? DD",33,0.23529411764705882,1619588569.0,0,0.43,1619103231.0,self.wallstreetbets,0,PlandomeProwler,2021-04-22 09:53:51,2021-04-28 00:42:49
GS,"DD. No one is talking about the student debt bubble! THIS COULD BE THE NEXT BIG SHOT.. SLM, NAVI, JPM, GS",122,-0.23255813953488372,1621240025.0,209,0.8,1613798603.0,self.wallstreetbets,0,pussydestroyerSPY,2021-02-19 23:23:23,2021-05-17 03:27:05
GS,"Historical Post Earnings Moves MEGA Compilation (Q2 Week 1) - $JPM, $GS, $WFC, $BAC, $MS, $TSM, and More",38,0.4444444444444444,1626149721.0,129,0.88,1626028874.0,self.wallstreetbets,0,FluxTradesStocks,2021-07-11 13:41:14,2021-07-12 23:15:21
GS,"$YANG GANG UPDATE- Banks Blowup, RE Troubles, & The China Contagion - An Evergrande Update - Part 2",185,0.30158730158730157,1632313314.0,419,0.92,1632141480.0,self.wallstreetbets,0,Ropirito,2021-09-20 07:38:00,2021-09-22 07:21:54
GS,Why am I all in on $ZIM,64,0.4,1635792746.0,145,0.96,1635430304.0,self.wallstreetbets,0,jlomohocob,2021-10-28 09:11:44,2021-11-01 13:52:26
GS,INTC the sleeping giant,156,0.17391304347826086,1636783614.0,99,0.79,1636189816.0,self.wallstreetbets,0,TachyonArray,2021-11-06 04:10:16,2021-11-13 00:06:54
